{
  "schema_version": 1,
  "updated_at": "2026-08-15T22:17:16Z",
  "state": "PHASE3_1_EXACT_013F_P1_REMEDIATION_LOCAL_GATE",
  "phase": "Phase 3.1 — Multi-instrument universe and broad BBO prefilter",
  "repository": "brullik/interexchange-perp-grid",
  "branch": "codex/multi-instrument-shadow",
  "pr": 5,
  "head_sha": "013f1d5fbeb470ed87295d0ebe941dd8c310e351",
  "ci_run": 31911068662,
  "artifact": "c4-3-proof-013f1d5fbeb470ed87295d0ebe941dd8c310e351",
  "completed_criteria": [
    "C4.3 exact-head GitHub Actions run 31892459783 and six-file artifact passed",
    "C4.3 independent adversarial and release verification passed with P0/P1/P2 all zero",
    "PR 1 was squash-merged and annotated prerelease v0.1.0-rc1 plus both GHCR tags were published and independently verified",
    "Wave 1 private snapshot uses two bounded account-wide calls and fails closed at documented page limits",
    "Wave 1 latest-value cache enforces persisted and ordered event watermarks, bounded reorder recovery, completeness, two-second age, hard timeouts, and measured 250 ms p95",
    "Native Bybit V5 u/seq guard is installed in the CCXT Pro factory and handles explicit u=1 reset",
    "Telegram shadow mode remains healthy without runtime credentials",
    "Phase 2 exact head 3bc15a3 passed independent adversarial and release verification with P0/P1/P2 all zero",
    "PR 4 was squash-merged as 0e87a1e and post-merge run 31904798345 passed all five jobs",
    "Phase 3.1 exact head 013f1d5 passed five GitHub jobs but independent review found late initial probe/discovery mutation, repeated startup ownership leaks, refresh outside the shutdown barrier, and partial factory rollback gaps; exact 013f remains prohibited from merge",
    "Current Phase 3.1 local gate passed: lock64, Ruff over 88 files, strict mypy over 86 source files, 301 tests, and doctor shadow/live denied",
    "Deterministic large universe proves 102 safe common instruments, 608 directed routes, 14-day age boundary, safe ambiguity isolation, and activity rejection",
    "The normalized committed Wave 1 fixture proves one common instrument and six directed routes with native Bybit minimum notional and explicit known-no-fixed-notional OKX semantics",
    "Broad BBO cache coalesces 100000 updates within known-key memory bounds, distinguishes stale from never-observed quotes, and measures latency from actual qualified quote receipt through prefilter ranking",
    "BBO watchers have a hard progress deadline, cancellation-safe one-per-venue retirement, idempotent transactional startup, single-flight bounded refresh and adapter recycle, one startup/recovery shutdown lifecycle barrier, partial-factory rollback, explicit shutdown and adapter-teardown failure, six-hour symbol resubscription, and jittered failure streaks reset only by an accepted quote",
    "Closing and reinstantiating the public engine reproduces identical universe, route, and cache bounds without leaked watcher tasks"
  ],
  "active_work": [
    "Commit and push the locally verified exact-013f remediation",
    "Obtain fresh exact-head CI and independent adversarial and release verification"
  ],
  "blockers": [
    "REPOSITORY_VISIBILITY_PUBLIC"
  ],
  "owner_action_file": "OWNER_ACTION.json",
  "next_action": "Keep PR 5 draft, publish the 301-test exact-013f remediation, and require fresh exact-head CI plus independent P0/P1-free adversarial and release verification before Phase 3.2.",
  "known_limitations": [
    "The current repository visibility is PUBLIC.",
    "Operational evidence and secrets remain forbidden while the repository is PUBLIC."
  ]
}
